Global Bakehouse Garlic Bread 450g, $1.00 / 100G
Riverina Dairy Cyprus Style Haloumi 900g, $23.33 / 1KG
Laughing Cow Cheese Original Wedges 256g, $33.20 / 1KG
Norco Lactose Free Full Cream Milk 2l, $3.15 / 1L
Latina Fresh Creamy Carbonara Pasta Sauce Creamy Carbonara 700g, $1.21 / 100G
Dare Triple Espresso Iced Coffee 500ml, $8.30 / 1L
Gippsland Dairy Twist Yoghurt Boysenberry 700g, $1.13 / 100G
Lurpak Butter Lighter Spreadable Slightly Salted 250g, $2.20 / 100G
Primo Stackers Chicken Cheese & Crackers 45g, $100.00 / 1KG
Primo Trios Cabanossi Cheese & Arnott's Bbq Shapes 50g, $90.00 / 1KG
So Good Almond Vanilla Milk 1l, $3.20 / 1L
Coyo Dairy Free Coconut Yoghurt Probiotic NoAddedSugar Natural 500g, $1.70 / 100G
Minor Figures Barista Organic Oat Milk 1L, $4.50 / 1L
Yoplait Petit Miam Mixed Flavour Variety Pack 100g x 12 pack, $0.47 / 100G
My Muscle Chef Thai Green Chicken Curry With Rice 320g, $3.73 / 100G
South Cape Greek Style Fetta 200g, $32.50 / 1KG
Maggie Beer Triple Cream Brie 200g, $46.50 / 1KG
