Thomas Dux Creamy Blue Cheese 150g, $30.00 / 1KG
Woolworths Chicken Buffalo Salad Bowl 180g, $36.11 / 1KG
Woolworths Creamy Potato Salad 250g, $1.60 / 100G
Cocobella Coconut Yoghurt Strawberry 500g, $1.20 / 100G
Bio Cheese Dairy Free Pizza Shred 200g, $45.00 / 1KG
Fancy Plants Chocolate Protein Plant Based Pudding 160g, $2.19 / 100G
Dairy Farmers Thick & Creamy Australian Berries Yoghurt 140g, $1.86 / 100G
Tasmanian Heritage Camembert Cheese 200g, $59.75 / 1KG
Mon Ami French Camembert Cheese 200g, $36.00 / 1KG
Dairy Farmers Thickened Cream 300ml, $1.13 / 100ML
Primo Stackers Spicy Chrizo Cheese And Crackers 50g, $90.00 / 1KG
Supafry Solid Oil 500g, $0.90 / 100G
Vitasoy Calci Plus Soy Milk 1l, $3.40 / 1L
Pro Live Fermented Probiotic Drink Blueberry Flavour 63mL x 10 pack, $10.48 / 100ML
