Woolworths Cream Cheese 250g, $12.40 / 1KG
Sanitarium So Good Barista Edition Almond Milk 1l, $4.00 / 1L
Woolworths Baby Leaf Rocket 120g, $27.50 / 1KG
Woolworths Leafy Mix Salad 200g, $15.00 / 1KG
YoPRO Perform High Protein Yoghurt No Added Sugar Mixed Berries 175g, $2.11 / 100G
YoPRO Perform High Protein Yoghurt Mango Passionfuit 175g, $2.11 / 100G
Woolworths Finely Shredded Coleslaw 300g, $10.00 / 1KG
Pauls Kids Bluey Vanilla Custard Pouch 70g, $2.71 / 100G
Vitasoy Oat Milky UHT Milk 1L, $3.00 / 1L
Bulla Cooking Cream 300ml, $1.23 / 100ML
