Gelativo Sorbet Passionfruit 1l Tub, $0.65 / 100ML
Golden Wok Asian Mini Dim Sims 660g, $1.82 / 100G
Birds Eye Deli Australian Hoki Fillets Light Batter 250g, $40.00 / 1KG
Herbert Adams Slow Cooked Beef, Caramelised Onion & Cabernet Sauvignon 2 Pack, $2.38 / 100G
Connoisseur Ice Cream Caramel Honey Macadamia 1l Tub, $1.20 / 100ML
Fropro Protein Burrito Chipotle Chicken 245g, $3.47 / 100G
Little Moons Mochi Bites Iced Latte Coffee 6 Pack, $5.21 / 100G
Fry's Plant Based Rice Protein & Chia Seed Nuggets 240g, $2.96 / 100G
