McCain Pub Size Bangers & Mash Frozen Meal 500g, $1.90 / 100G
Tegel Take Outs Flame Grilled Chicken Steaks 600g, $21.67 / 1KG
Herbert Adams Slow Cooked Beef With Shiraz & Cracked Pepper 2 Pack, $2.38 / 100G
Jase's Kitchen Crumbed Zucchini Wedges 500g, $14.00 / 1KG
Woolworths Belgian Chocolate Lava Cake 2 Pack 180g, $2.78 / 100G
Cheesebuddy Gluten Free Cheese Puffs 450g, $1.69 / 100G
McCain Pickers Mozzarella Mini Sticks Italian Herb 230g, $3.26 / 100G
Coco & Lucas' Spaghetti Bolognese Frozen Meal 220g, $2.41 / 100G
La Gina Woodfired Pumpkin Mozzarella & Feta Italian Pizza 405g, $1.85 / 100G
