Birds Eye Deli Seasoned Chips Sea Salt & Rosemary 600g, $10.00 / 1KG
Steggles Chicken Breast Tenders Crumbed 1kg, $13.50 / 1KG
Creative Gourmet Frozen Pineapple Pieces 500g, $12.00 / 1KG
Steggles Chicken Dino Snacks Tempura 1kg, $13.50 / 1KG
McCain Corn Kernels 500g, $8.00 / 1KG
Borg's Pastizzis Triangles Spinach & Ricotta 360g, $1.11 / 100G
Birds Eye Snap Frozen Carrot, Cauliflower & Broccoli 1kg, $6.50 / 1KG
Ingham's Frozen Chicken Breast Tenders Sweet Chilli 400g, $13.75 / 1KG
Bulla Murray St Ice Creamery Vanilla Bean Ice Cream 1l, $1.20 / 100ML
Essentials French Fries 1kg, $4.00 / 1KG
