Vittoria Coffee Capsules Extra Strong Variety Pack 40 Pack, $0.45 / 1EA
Always Fresh Lemon & Chilli Split Green Olives 240g, $2.50 / 100G
Beerenberg Chipotle Ranch Sauce 300ml, $2.47 / 100ML
Chobani Long Life Oat Milk Original 1L, $5.00 / 1L
Fine Fettle Helpful Harvest Dehydrated Veggie Mix For Pasta Bolognese 40g, $162.50 / 1KG
Hart & Soul Pho Konjac Soup Pouch 400g, $1.13 / 100G
Katoomba Ingredients Moong Dal 1kg, $0.47 / 100G
Katoomba Ingredients Tyson Chickpeas 1kg, $0.25 / 100G
L'Or Coffee Artiste 8 Vigoroso 95g, $13.16 / 100G
Lavazza Tales of Italy Enchanting Capri Ground Coffee 250g, $6.40 / 100G
Maharajah's Choice Cinnamon Quills 100g, $2.80 / 100G
Maharajah's Choice Rice Flakes 500g, $0.44 / 100G
MasterFoods Perfect For Fish Spice Blend 20g, $1.25 / 10G
McCormick Australian Native Mountain Pepper Spice Rub 20g, $1.50 / 10G
McCormick Grill Mates Garlic & Crushed Herbs With Salt & Pepper 155g, $4.52 / 100G
Mogu Mogu Mango Drink 1l, $4.95 / 1L
Mr Chen's Sweet Soy Sauce 250mL, $1.14 / 100ML
Mr Chen's Vietnamese Beef Pho Kit 500g, $1.70 / 100G
Nestle Polo Mints 34g, $6.62 / 100G
