Noshu 97% Sugar Free Dark Choc Baking Chips 140g, $3.43 / 100G
Sacla Basil Pesto Free From 190g, $3.11 / 100G
Continental Classics Cup a Soup Chinese Chicken & Corn 66g, $4.24 / 100G
Kook A Krumb Breadcrumbs Herb And Garlic 200g, $1.85 / 100G
Sunrice Clever Rice Low Gi White 1kg, $0.46 / 100G
Angas Park Soft & Juice Pitted Prunes 250g, $22.00 / 1KG
Fehlbergs Sandwich Stackers 500g, $8.00 / 1KG
Galiko All Natural Garlic Minced Jar 145g, $0.21 / 10G
Sanitarium Up&Go Liquid Breakfast Choc Ice 6 Pack, $8.00 / 1L
Twinings Chai Vanilla Tea Bags 10 Pack, $0.30 / 1EA
