Calbee Potato Chips Pizza Flavoured 55g, $6.36 / 100G
Carman's Granola Grain Free Raspberry, Blueberry & Cranberry 400g, $4.00 / 100G
Chuanwazi Red Chilli Pepper Oil 230g, $1.96 / 100G
Grinders Espresso Ground Coffee 200g, $5.50 / 100G
Hengshun Chin Kiang Vinegar 550mL, $0.51 / 100ML
Ito En Lychee Ice Tea Decaf 535ml, $5.05 / 1L
Jordans Light Crunch Granola Triple Nut 425g, $2.12 / 100G
Lakanto Golden Monkfruit Sweetener 500g, $3.20 / 100G
Lighthouse Pizza & Focaccia Bread Mix 1kg, $6.60 / 1KG
Massel Organic Liquid Stock Beef 1l, $0.42 / 100ML
Mingle Better Sweet Chilli Sauce 250g, $2.38 / 100G
Nissin Ramen Kyushu Black 5 Pack, $1.60 / 100G
Nonna Maria's Authentic Passata 660G, $0.55 / 100G
Old El Paso Tortilla Corn Chips Original 350g, $1.99 / 100G
Podravka Beef Goulash 300g, $16.67 / 1KG
S&B Miso Soup Aka 30g, $14.00 / 100G
The Jelly Co Konjac Jelly Juicy Peach 150g, $2.40 / 100G
