Mr Chen's Thai Green Curry Paste 190g, $1.21 / 100G
Podravka Vegeta Vegetable Gourmet Stock Powder 500g, $0.15 / 10G
Sweet Baby Ray's BBQ Sauce 425mL, $1.76 / 100ML
Ayam Teriyaki Sauce 210ml, $1.90 / 100ML
Blue Banner Tasmanian Pickled Onions 525g, $1.24 / 100G
Carman's Granola 5 Grain & Seed Almond Vanilla & Cinnamon 450g, $1.89 / 100G
Meiji Biscuit Hello Panda Snacks Chocolate 50g, $4.20 / 100G
Taylor's Simmer Sauce Peanut Satay 525g, $0.95 / 100G
Aeroplane Jelly Lite Lime Flavour Low Calorie Jelly Crystals 2x9g, $13.89 / 100G
Buderim Ginger Naked Ginger Uncrystallised 175g, $28.57 / 1KG
S&B Curry Mix Golden Medium Hot 92g, $5.43 / 100G
St Dalfour Orange Marmalade 284g 284g, $2.01 / 100G
Frank's Redhot Original Cayenne Pepper Hot Sauce 148ml, $2.70 / 100ML
