Altimate Waffle Ice Cream Cones 12 Pack, $3.40 / 100G
Betty Crocker Strawberry Gluten Free Frosting 400g, $1.63 / 100G
Carman's Clusters Aussie Oat Apple Crunch 800g, $1.19 / 100G
Illy Espresso Forte Capsules 10 Pack, $0.80 / 1EA
Nando's Hot Peri-Peri Chilli Sauce Peri Peri Sauce 250g, $2.72 / 100G
Noya Cashew Nut Butter 250g, $3.80 / 100G
Russino Anchovies Flat 80g, $57.50 / 1KG
Sole Mare Mackerel Fillets In Olive Oil 120g, $33.33 / 1KG
Sunrice Microwave Mexican Flavoured Rice Cups 2x125g 250g, $1.60 / 100G
Sunsol Granola Almond & Super Berry 450g, $1.67 / 100G
Tetley Decaffeinated Green Tea Bags 50 Pack, $0.09 / 1EA
The Pancake Parlour Pancake Mix 500g, $1.79 / 100G
Unox Cream of Mushroom Soup In A Cup 2 pack, $3.29 / 100G
Ainsley Harriott Cous Cous Roasted Vegetable 100g, $2.60 / 100G
Bickford's Iced Caramel Coffee Syrup 500ml, $1.40 / 100ML
Campbell's Chunky Soup Irish Stew Style 505g, $0.89 / 100G
Carman's Muesli Toasted Super Berry, Cranberry & Blueberry 500g, $1.50 / 100G
