Wei Chuan Dumpling Sauce Original 190ml, $1.84 / 100ML
Continental Sensations Spicy Malaysian Chicken Laksa With Noodles 62g, $5.65 / 100G
Famous House Banana Milk 500ml, $5.20 / 1L
Gravox Traditional Gravy Mix 200g, $0.21 / 10G
Hart & Soul Hearty Pumpkin & Lentil Soup 400g, $1.13 / 100G
Hart & Soul Thai Chicken Saucy Noodles Box 330g, $1.67 / 100G
Hoyt's Vanilla Sugar 25G, $0.60 / 10G
Nestle Nesquik Cereal 600g, $1.47 / 100G
Only Organic Nourish Soup Tomato Capsicum Potato & Wild Rice 320g, $1.56 / 100G
Paldo Dosirac Hot Spicy Noodles King Cup 110g, $2.45 / 100G
Pandaroo Ingredients Mushroom Chinese Sliced 40g, $87.50 / 1KG
Pukka Feel New Inner Beauty Organic Herbal Tea Sachets 20 pack, $0.43 / 1EA
Pukka Organic Herbal Tea Collection 20 Pack, $0.43 / 1EA
Sunbeam Sunmuscat Sultanas 450g, $12.22 / 1KG
Twinings Earl Grey Tea Bags 50 Pack, $0.17 / 1EA
Twinings Live Well Digest Tea Bags 22 Pack, $0.39 / 1EA
