Bonne Maman Raspberry Jam 370g, $1.81 / 100G
Continental Classics Cup a Soup Laksa With Noodles 65g, $4.31 / 100G
Ben's Original Tomato & Basil Microwave Rice Pouch 250g, $1.60 / 100G
CSR Icing Sugar Soft Mixture 500g, $0.50 / 100G
Edgell Corn Kernels 125g, $11.20 / 1KG
Old El Paso Thick 'n Chunky Salsa Mild Thick & Chunky 375g, $1.47 / 100G
Campbell's Real Stock Beef Liquid Stock 250ml, $0.72 / 100ML
Edgell Snack Time Chickpeas Salad Topper With Zesty Vinaigrette 70g, $22.86 / 1KG
Twinings Pure Camomile Tea Bags 10 Pack, $0.30 / 1EA
Aeroplane Jelly Lite Strawberry Flavour Low Calorie Jelly Crystals 2x9g, $13.89 / 100G
Edgell Snack Time Chickpeas With Lemon, Tahini & Garlic 70g, $22.86 / 1KG
Patak's Ready To Eat Pappadums Mini Plain Original 75g, $6.40 / 100G
