Katoomba Ghee 700mL, $2.86 / 100ML
Kellogg's Pop Tarts Frosted Strawberry Toaster Pastries 384g, $1.82 / 100G
Vittoria Mountain Grown Ground Coffee 1kg, $4.90 / 100G
Wallaby Plain All Purpose Flour 1kg, $4.00 / 1KG
Amy's Kitchen Hearty Organic Quinoa, Kale & Red Lentil Soup 408g, $1.08 / 100G
Cobram Garlic & Onion Infused Extra Virgin Olive Oil 250mL, $4.40 / 100ML
Conimex Ketjap Manis Sweet Soy Sauce 240ml, $2.50 / 100ML
Kikkoman Naturally Brewed Soy Sauce Less Salt 250ml, $2.68 / 100ML
King Oscar Sardines Tomato Sauce Single Layer 105g, $29.05 / 1KG
Mogu Mogu Lychee Drink 1l, $4.95 / 1L
Nestle Plaistowe Cocoa Premium 180g, $5.42 / 100G
St Dalfour Royal Fig 284g 284g, $2.01 / 100G
St Dalfour Strawberry & Rhubarb 284g 284g, $2.01 / 100G
Sunsol Toasted Muesli Strawberry, Macadamia & Coconut 500g, $1.50 / 100G
Ayam Panang Curry Paste Panang Curry 195g, $2.05 / 100G
