Avalanche Chai Latte Cafe Style Sachets 10 Pack, $0.55 / 1EA
Baxters Chilli Jam 225G, $2.40 / 100G
Continental Soup Sensations Harvest Pumpkin & Sour Cream Serves 2 70g, $5.00 / 100G
Dolce Gusto Espresso Intenso Coffee Pods Capsules 16 Pack, $0.63 / 1EA
Dollar Sweets Artificial Food Colours 8 Pack, $0.88 / 10ML
Hoyt's Poppy Seed 100G, $0.23 / 10G
Leggo's Gourmet Pasta Sauce Tomato & King Island Cheddar Cheese 390g, $1.41 / 100G
Lighthouse Yeast Bread Improver 10x7g, $8.86 / 100G
Macro Organic Dill Cucumbers 500g, $0.90 / 100G
Taylor's Simmer Sauce Kashmiri Butter Chicken 485g, $1.03 / 100G
Three Threes Tomato Sauce 275ml, $1.20 / 100ML
Baxter's Fig & Date Balsamic Chutney 235g, $2.30 / 100G
Bryne Co Pickled Baby Cucumbers 500g, $0.60 / 100G
