Aeroplane Ready To Eat Jelly Cup Snack Raspberry Flavour 120g, $1.33 / 100G
Obento Japanese Panko Breadcrumbs 200g, $1.45 / 100G
Old El Paso Taco Kit Mexican Style Taco Kit 290g, $2.93 / 100G
Maggi Gravy Mix Roast Chicken 24g, $0.52 / 10G
Three Threes Australian Apple Sauce 250g, $1.16 / 100G
Ben's Original Coconut, Chilli & Lemongrass Microwave Rice Pouch 250g, $1.60 / 100G
Dolmio 7 Vegetable Bolognese Pasta Sauce 500g, $0.98 / 100G
Pandaroo Japanese Ginger Sushi 200g, $1.85 / 100G
So Good Almond Vanilla Milk 1l, $3.20 / 1L
Beerenberg Strawberry Jam 300g, $2.00 / 100G
Nestle Bakers' Choice Milk Choc Melts 290g, $2.07 / 100G
So Soft Marshmallow Minis 100g, $2.90 / 100G
Minor Figures Barista Organic Oat Milk 1L, $4.50 / 1L
