Amoy Sauce Oyster 555g, $1.17 / 100G
Ardmona Pie Fruit Apples Sliced 400g, $10.50 / 1KG
Hoyt's Chives 15G, $1.60 / 10G
Hoyt's Rosemary 25g, $0.68 / 10G
Laucke Crusty White Bread Mix 2.4kg, $4.54 / 1KG
Lighthouse Plain Flour For Pasta Tipo "00" 1kg, $4.00 / 1KG
Praise Burger Sauce Aioli 250ml, $1.80 / 100ML
Sirena Tuna Smoky Chilli 95g, $31.05 / 1KG
Sirena Tuna Sweet Chilli 95g, $31.05 / 1KG
Ben's Original Indian Style Spiced Microwave Rice Pouch 250g, $1.60 / 100G
MasterFoods Tarragon Leaves 7g, $5.21 / 10G
McCormick Organic Chilli Flakes 12g, $2.29 / 10G
Nong Shim Kimchi Ramen Big Bowl 112g, $3.35 / 100G
Rosella Green Cocktail Onions 150g, $16.67 / 1KG
Beerenberg Chilli Jam 190g, $2.53 / 100G
