Sirena Tuna Slices In Oil Italian Style 125g, $31.20 / 1KG
Sunrice Microwave Brown Rice Pouch 250g, $1.40 / 100G
Woolworths Macadamias Pieces 120g, $40.83 / 1KG
Slendier Edamame Bean Fettuccine 200g, $2.65 / 100G
Sunrice Microwave Basmati Rice 250g, $1.40 / 100G
Uncle Tobys Oats Quick Sachets Brown Sugar & Cinnamon Porridge 350g, $1.80 / 100G
Dolmio Extra Garden Vegetables Tomato Pasta Sauce 500g, $0.92 / 100G
Heinz Big n Chunky Beef & Vegetable Soup Veggie Ready Meals 535g, $0.82 / 100G
Heinz Classic Chicken & Sweetcorn Soup 535g, $0.82 / 100G
Vegemite Squeezy 350g, $2.09 / 100G
Hakubaku Organic Japanese Udon Noodle 270g, $1.48 / 100G
MasterFoods Garlic Powder 50g, $0.70 / 10G
Moro Vinegar Red Wine 500ml, $1.00 / 100ML
Tandaco Dry Yeast 12x7g Sachets 84g, $6.55 / 100G
Ayam Paste Thai Green Curry 195g, $2.05 / 100G
