Batchelors Mushy Peas Canned Chip Shop 300g, $0.97 / 100G
Beechworth Bee Cause 100% Australian Bush Honey Jar 550g, $2.00 / 100G
Gravox Roast Chicken With Herbs Family Pack Liquid Gravy Pouch 250g, $1.80 / 100G
Heinz Big n Chunky Mexican Chilli Beef Soup Ready Meals 520g, $0.85 / 100G
Heinz Seriously Good Caramelised Onion Aioli 295mL, $1.86 / 100ML
Kikkoman Gyoza Dumpling Dipping Sauce 150ml, $2.67 / 100ML
Marion's Kitchen Red Curry Paste 190g, $3.16 / 100G
MasterFoods Garlic & Truffle Flavour No Rules Sauce 250ml, $1.92 / 100ML
Mission Salt Reduced Tortillas 12 Pack, $0.78 / 100G
Paramount Salmon Pink 415g, $15.90 / 1KG
Sunbeam Mixed Fruit 375g, $14.67 / 1KG
The Spice Tailor Rustic Rogan Josh 300g, $2.07 / 100G
Vittoria Coffee Decaffeinated Coffee Bags 20 Pack, $0.75 / 1EA
Wokka Noodle Box Honey Soy 350g, $1.43 / 100G
Ayam Vegetarian Oyster Sauce 210ml, $1.90 / 100ML
Coco Earth Butter Chicken With Naan 360g, $1.94 / 100G
Lee Kum Kee Chili Oil Chiu Chow 205g, $2.93 / 100G
