Katoomba Ingredients Chana Dal 1kg, $0.30 / 100G
Lee Kum Kee Oyster Stir Fry Sauce 255g, $1.73 / 100G
Macro Wholefoods Market Grain Free Granola Cacao & Hazelnut Butter 300g, $2.33 / 100G
Maesri Panang Curry Paste 114g, $2.02 / 100G
MasterFoods Garlic Pepper 50g, $0.70 / 10G
McClure's Sweet & Spicy Pickles 500g, $1.20 / 100G
Mr Chen's Japanese Ramen Kit 604g, $1.41 / 100G
Mr Chen's Pad Thai Meal Kit 324g, $2.62 / 100G
Origin Tea Original Sticky Chai 120g, $7.50 / 100G
Sandhurst Black Beans 380g, $5.00 / 1KG
Sugarless Stevia Organic 350g, $2.43 / 100G
Sunrice Microwave Japanese Teriyaki Style Rice Cups 125g X 2 pack, $1.60 / 100G
The Dutch Company Confectionary 4 Syrup Wafers 125g, $2.44 / 100G
Angas Park Apricots 375g, $34.67 / 1KG
Beerenberg Mango, Lime & Chilli Dressing 300ml, $2.23 / 100ML
Benino Red Roasted Peppers 465g, $1.29 / 100G
Britannia Little Hearts 75g, $1.67 / 100G
Campos Decaf Coffee Beans 500g, $6.70 / 100G
Colman's Ingredients English Mustard 100G, $4.60 / 100G
