Maggi Oyster Sauce 275ml, $1.31 / 100ML
Rana Egg Lasagne Pasta 250g, $2.20 / 100G
Ayam Satay Sauce 250ml, $1.56 / 100ML
Sunrice Microwave Brown Rice & Quinoa Pouch 450g, $1.00 / 100G
Golden Circle Tinned Corn Canned Vegetables Tin Corn Kernels 410g, $5.37 / 1KG
Lavazza Crema e Gusto Nespresso Compatible Coffee Pods 10 Pack, $0.85 / 1EA
Hoyt's Sesame Seeds Jar 230G, $0.23 / 10G
Barilla Pasta Spaghettoni 500g, $0.70 / 100G
Sacla Tomato Pesto Free From 190g, $3.11 / 100G
Skippy Creamy Peanut Butter 462g, $0.97 / 100G
MILKLAB Oat Milk Home Barista Edition 1L, $0.55 / 100ML
