Passage To India Veg Curry Bowl Butter Masala With Rice 280G, $1.96 / 100G
Podravka European Foods Chicken Noodle Soup 62g, $4.44 / 100G
Republica Freeze Dried Colombian Coffee Instant Coffee 100g, $12.00 / 100G
Sandhurst Red Kidney Beans 380g, $5.00 / 1KG
Snakz Bites Salted Egg Spread 250g, $2.20 / 100G
Tabasco Habanero Sauce 60ml, $10.00 / 100ML
Tunnock's Snacks Caramel Wafer 8 Pack 240G, $2.79 / 100G
Vittoria Mountain Grown Ground Coffee 500g, $5.30 / 100G
Al Barakah Dates Date Syrup Squeeze 400G, $1.31 / 100G
Ayam Sago Dessert 200g, $2.75 / 100G
Bickford's Iced Mocha Coffee Syrup 500ml, $1.40 / 100ML
Caffe Aurora Chicco D'Oro Espresso Coffee Capsules 12 pack, $0.41 / 1EA
Fanta Pineapple & Grapefruit Soft Drink Can 330ml, $8.18 / 1L
Heilala Baking Blend Vanilla Bean Paste 65g, $12.15 / 100G
Higher Living Chai Green Each, $0.25 / 1EA
Jamie Oliver Italian Herb Pesto Italian Herb 190g, $3.58 / 100G
La Zuppa Soup Pouch Chunky Tomato & Veg 400g, $1.18 / 100G
Lucky Natural Cashews 150g, $33.33 / 1KG
