Continental Classics Pasta & Sauce Chicken Curry Family Pack 150g, $2.53 / 100G
Sirena Tuna Triple Chilli 95g, $31.05 / 1KG
Bega Peanut Butter Crunchy 470g, $1.47 / 100G
Clive Of India Curry Powder 100g, $0.40 / 10G
Hamper Corned Beef Original Canned Meat 340g, $24.12 / 1KG
Freedom Classic Rice Puffs Cereal 250g, $2.24 / 100G
Kellogg's Special k Original Breakfast Cereal 300g, $2.33 / 100G
San Remo Gluten Free Brown Rice Penne 250g, $1.80 / 100G
Sustagen High Protein Nutrition Top-Up Dutch Chocolate Ready To Drink 250mL x 3 pack, $8.93 / 1L
Mutti Sugo Semplice Bolognese Pasta Sauce 400g, $1.13 / 100G
