Vittoria Freeze Dried Decaffeinated Instant Coffee 100g, $13.50 / 100G
Beerenberg Australian Fruit Chutney 180g, $2.67 / 100G
Buderim Ginger Crystallised Ginger 200g, $30.00 / 1KG
Campbell's Country Ladle Soup Hearty Beef & Vegetable 500g, $0.90 / 100G
Gourmet Garden Paste Italian 80g, $0.50 / 10G
Green's Pudding Traditional Sticky Date 260g, $1.44 / 100G
Hart & Soul All Natural Supergrain Satay Chicken 250g, $2.20 / 100G
Heinz Soup Of The Day Pumpkin Cauliflower & Turmeric 430g, $1.05 / 100G
John West Smoked Kippers Fillets In Brine 200g, $19.50 / 1KG
Leggo's Gourmet Rich Australian Tomato Passata Puree Sauce 690g, $0.70 / 100G
Mazzetti Vinegar Balsamic Vintage 4 Leaf 250ml, $2.72 / 100ML
Milka Choco Cow 120g, $4.17 / 100G
Nerada Organics Green Tea Cup Bags 150g, $0.09 / 1EA
Ohlio Sunflower Oil & Moro Extra Virgin Olive Oil Blend 1L, $0.95 / 100ML
PG Tips Tea Bags 116G Each, $0.15 / 1EA
Plantwell High Protein Soy Milk Bone & Gut 1L, $4.50 / 1L
Sirena Ready To Eat Mexican Rice With Chicken 190g, $2.26 / 100G
Vittoria Coffee Bags Espresso 20 Pack, $0.70 / 1EA
Wallaby Bread Improver 125g, $4.16 / 100G
