Valcom Paste Thai Panaeng Curry 210g, $2.05 / 100G
Well & Good Gluten Free Pastry Flour 400g, $16.25 / 1KG
Always Fresh Roasted Peppers Whole 330g, $16.67 / 1KG
Bonne Maman Caramel Spread 380g, $1.76 / 100G
CLUB Orange 330ml, $0.91 / 100ML
Calbee Harvest Snaps Tasty Toppers Parmesan & Black Pepper 60g, $5.00 / 100G
Campbell's Country Ladle Soup Potato & Leek 505g, $0.89 / 100G
Campbell's Country Ladle Soup Rich & Creamy Pumpkin 500g, $0.90 / 100G
Campos King St Coffee Beans Creamy & Balanced Blend 500g, $6.40 / 100G
Dollar Sweets Funny Faces 25g, $12.00 / 100G
Hoyt's Poppy Seed 240G, $0.21 / 10G
Indya Mustard Oil 1L, $0.60 / 100ML
Jeeny's Paste Shrimp 80g, $4.13 / 100G
Krakus European Foods Pickled Dill Cucumbers 850g, $0.82 / 100G
Old El Paso Tortilla Pockets Kit Original Mexican Style 375g, $2.53 / 100G
Queen Diamond Dates Pitted 250g, $0.94 / 100G
Ritter Sport Sport Chocolate Milk Whole Hazelnut 100G, $5.60 / 100G
Tean's Gourmet Tumisan Kari Ayam Paste For Chicken Curry 200g, $1.73 / 100G
