MasterFoods Ground Cayenne Pepper 30g, $1.40 / 10G
McKenzie's Pepper Black Coarse Milled 100g, $0.42 / 10G
Nibblish Gently Baked Strawberry 80g, $78.13 / 1KG
Praise Creamy Lime & Herb Dressing 250ml, $1.52 / 100ML
Sunshine Sugar Low GI Sugar 1kg, $0.30 / 100G
Vittoria Freeze Dried Instant Coffee Latte 100g, $12.50 / 100G
Wai Wai Oriental Instant Noodles 60g, $1.42 / 100G
Always Fresh Cucumbers Polish Ogor 680g, $6.76 / 1KG
Bryne Co Pickled Dill Gherkins 500g, $0.60 / 100G
Capilano 100% Pure Australian Honey Organic Raw Squeeze 340g, $2.06 / 100G
Edgell Snack Time Sweet Corn With Smoked Paprika Salt & Pepper 70g, $22.86 / 1KG
Gravox Lamb & Rosemary Family Pack Liquid Gravy Pouch 250g, $1.80 / 100G
Heinz Soup Potato & Leek Soup 430g, $1.05 / 100G
Hermesetas Mini Sweetener Tablets 800 Pack, $0.98 / 100EA
John West Tuna & Beans Capsicum Sweet Corn Red Kidney Beans Chilli 185g, $23.78 / 1KG
Sanitarium Up&Go Dairy Free Liquid Breakfast Vanilla Ice 3 Pack, $8.67 / 1L
Stevia Sweet Sweet Tablets 220 Pack, $3.91 / 100EA
