Woolworths Oregano Leaves 10g, $2.00 / 10G
Sanitarium So Good Barista Edition Soy Milk 1l, $3.00 / 1L
CSR Raw Sugar 1kg, $0.32 / 100G
Edgell Australian Sliced Beetroot 225g, $8.89 / 1KG
Kellogg's Corn Flakes Breakfast Cereal 450g, $1.31 / 100G
Woolworths Paprika Ground 30g, $0.60 / 10G
CSR Icing Sugar Pure 500g, $0.50 / 100G
Woolworths Pink Himalayan Salt Grinder 110g, $0.33 / 10G
Pandaroo Ingredients Rice Paper Spring Roll 150g, $1.53 / 100G
Woolworths Crunchy Peanut Butter 500g, $0.68 / 100G
Grand Italian Fresh Potato Gnocchi 500g, $1.20 / 100G
Woolworths Extra Virgin Spanish Olive Oil 1l, $1.80 / 100ML
Mission White Strip Corn Chips 500g, $1.50 / 100G
Vetta Smart Protein Penne Pasta 375g, $0.80 / 100G
