Old El Paso Stand 'n Stuff Taco Shells Taco Shells 10 Pack, $3.44 / 100G
Mutti Passata 700g, $0.69 / 100G
San Remo Gluten Free Spaghetti 350g, $1.29 / 100G
San Remo Rigatoni Pasta No 22 500g, $0.59 / 100G
Leggo's Australian Grown Tomato Paste Triple Concentrate Tub 140g x 2 pack, $1.25 / 100G
Barilla Pasta Fusilli 500g, $0.70 / 100G
Cadbury Baking Dark Chocolate Chips 200g, $2.50 / 100G
Latina Fresh Lasagne Sheets Sheets 375g, $1.60 / 100G
Obento Japanese Yaki Nori For Sushi Each, $16.00 / 100G
