Three Threes Sweet Mustard Pickles 250g, $9.00 / 1KG
Woolworths Tuna & Crackers Snack Pack Thousand Island 112g, $18.75 / 1KG
Barilla Gluten Free Fusilli 340g, $1.38 / 100G
Chobani Oat Milk Barista Edition 1l, $5.00 / 1L
Edgell Canned Butter Beans Picked And Soaked Legumes 400g, $5.50 / 1KG
Queen Natural Vanilla Extract 150ml, $6.67 / 100ML
Tabasco Chilli Sauce Red Pepper 60ml, $9.17 / 100ML
Twinings Camomile & Spiced Apple Tea Bags 10 Pack, $0.30 / 1EA
Always Fresh Cucumbers Sweet & Sour 680g, $6.76 / 1KG
Dilmah Extra Strength Tea Bags 100 Pack, $0.09 / 1EA
Leggo's Pasta Sauce Spaghetti With Beef 680g, $0.74 / 100G
Trident Pitted Dates 600g, $7.92 / 1KG
Vetta Smart Fibre Penne Pasta 500g, $0.47 / 100G
Chang's Crunchy Noodles Noodles 100g, $1.70 / 100G
Nando's Medium Rub Spice Seasoning 25g, $1.36 / 10G
