Macro Organic Lean Beef Mince 500g, $28.00 / 1KG
Just Caught Raw Prawn Meat 300g, $40.00 / 1KG
Don Short Cut Rindless Bacon 200g, $33.00 / 1KG
Woolworths Bbq Chicken Breast Steaks With a Honey Mustard Marinade 500g, $21.00 / 1KG
Woolworths Classic Cumberland Pork Sausages 500g, $18.00 / 1KG
Chicken Schnitzel Parmi Crumbed Each, $3.70 / 1EA
Woolworths Cook Slow Cooked Beef Brisket 700g, $22.14 / 1KG
D'Orsogna Maple Glazed Streaky Bacon 200g, $37.50 / 1KG
Primo Kransky Double Smoked From The Deli Per Kg, $22.50 / 1KG
